{"candidateDependencyUsed":false,"candidateOutputUsed":false,"contentHash":"8e278d6791fbf609f22dedf5009bfb4df502f59833376df34fbef008ad17f305","evidenceBoundary":{"c1":0,"e1":0,"formalEvidence":false,"g1":0,"o1":0,"productSupport":false,"r1Pipeline":0,"r1ProductRelease":0,"r1ProductValidation":0,"releaseAllowlist":"none","releaseApproved":0,"releaseRegistered":0,"u1":0,"v1":0},"expectedCanonicalJson":"{\"alphaMode\":\"straight-unpremultiplied\",\"alphaPresent\":false,\"animation\":\"forbidden\",\"colorSpace\":\"embedded-sRGB\",\"decodedPixelSha256\":\"65ed7066d7c0e682a46a1101de293408d802fea71e652bd0df7705ba224cfa6d\",\"fileSha256\":null,\"height\":13,\"interlace\":\"forbidden\",\"metadataPolicy\":\"strip-all-except-color-contract\",\"mime\":\"image/png\",\"orientation\":1,\"parentIdentity\":{\"artifactSha256\":\"2a25a348a8e0ab9e57dc30ffa78fd70e554bfb9a984161c833fd18a1e9647cc1\",\"decodedPixelSha256\":\"65ed7066d7c0e682a46a1101de293408d802fea71e652bd0df7705ba224cfa6d\",\"fileSha256\":\"179983a18a8ef2b44f60eb416b80e1496d8e3a3fd16dbacc109825004cf1c8f3\",\"id\":\"normalized.s05.export.dev.003\",\"manifestSha256\":\"76638c9c811e197c4dcd17ab6d0bb224c15685a2cf08763c8a2aa84e264ab75b\"},\"pixelLayout\":\"RGBA8\",\"pngFilterPolicy\":\"filter-0-only\",\"width\":17}","frozenAt":"2026-08-15T23:01:50.529Z","id":"gold-identity.s11.export.dev.003","independenceClaim":false,"manifestLocator":{"id":"FM-OPEN-CALIBRATION-EXPORT-DEV@0.11.0","path":"manifests/export-dev.v0.11.0.json"},"operation":"export","partition":"dev/calibration","priorSlice10GoldIdentityRef":{"byteLength":2541,"contentHash":"84b81ce4b37dc6476faf218504321af536bfa63fe9e4081c8efdce75228d686d","fileSha256":"313c98abb7d58b44d5a59cd2ee3a8eaba1515684d2c0ffa962813c0252f7ff11","id":"gold-identity.s10.export.dev.003","path":"research/slice-10/gold-identities/export/dev-calibration/gold-identity.s10.export.dev.003.json"},"schemaVersion":"gold-identity.slice11.v0","sourceRef":{"byteLength":1785,"contentHash":"a603bb62a05b6bf6ef44c395e0447d1365badd5587542135c97365adea379244","fileSha256":"2572b45dda5047e2f1fe5bcb1176a8b04141b0283cd3b5127ae08b547c5dae0c","id":"s11.export.dev.003","path":"source-lineage/export/dev-calibration/s11.export.dev.003.json"}}
