{"candidateDependencyUsed":false,"candidateOutputUsed":false,"contentHash":"5f914c4e636f789d6dccbcfec476278abe334cdfb600710cab7e6fe05b047d69","evidenceBoundary":{"c1":0,"e1":0,"formalEvidence":false,"g1":0,"o1":0,"productSupport":false,"r1Pipeline":0,"r1ProductRelease":0,"r1ProductValidation":0,"releaseAllowlist":"none","releaseApproved":0,"releaseRegistered":0,"u1":0,"v1":0},"expectedCanonicalJson":"{\"alphaMode\":\"straight-unpremultiplied\",\"alphaPresent\":true,\"animation\":\"forbidden\",\"colorSpace\":\"embedded-sRGB\",\"decodedPixelSha256\":\"0f3bad18eddbce07e23fa8f7e7977d2ec9b4b0e9e8973330db5a8cfe5051bb8b\",\"fileSha256\":null,\"height\":10,\"interlace\":\"forbidden\",\"metadataPolicy\":\"strip-all-except-color-contract\",\"mime\":\"image/png\",\"orientation\":1,\"parentIdentity\":{\"artifactSha256\":null,\"decodedPixelSha256\":\"0f3bad18eddbce07e23fa8f7e7977d2ec9b4b0e9e8973330db5a8cfe5051bb8b\",\"fileSha256\":\"b11a49b022811d5c2fa1f697402d887b7507d3176a2059f8cf349a2830a6cbb3\",\"id\":\"raw.s05.normalize.dev.009\",\"manifestSha256\":\"114635f6f938fbaebe7b6e2d8223f9ce4cdc7923cb17c179bfedc36e890492f6\"},\"pixelLayout\":\"RGBA8\",\"pngFilterPolicy\":\"filter-0-only\",\"width\":8}","frozenAt":"2026-08-15T23:01:50.529Z","id":"gold-identity.s11.normalize.dev.009","independenceClaim":false,"manifestLocator":{"id":"FM-OPEN-CALIBRATION-NORMALIZE-DEV@0.11.0","path":"manifests/normalize-dev.v0.11.0.json"},"operation":"normalize","partition":"dev/calibration","priorSlice10GoldIdentityRef":{"byteLength":2173,"contentHash":"59fdedd32bb6106a678aca04f55a8fedadecb26e96631ab469e918cde1548eb1","fileSha256":"178d94afd9887243e759dea00a435e59023cfacb5271ea3cd6117085d0b5e767","id":"gold-identity.s10.normalize.dev.009","path":"research/slice-10/gold-identities/normalize/dev-calibration/gold-identity.s10.normalize.dev.009.json"},"schemaVersion":"gold-identity.slice11.v0","sourceRef":{"byteLength":1823,"contentHash":"b0bb3c70c6839e5231985102e82941a4f22a5a7144005451ffcb2bc33f6112a1","fileSha256":"b6cf0b3d7997e27ca6570f66ef6ce1a21c239c579b4b3a14c9c63882b4bf2ec0","id":"s11.normalize.dev.009","path":"source-lineage/normalize/dev-calibration/s11.normalize.dev.009.json"}}
