{"candidateDependencyUsed":false,"candidateOutputUsed":false,"contentHash":"1404ab7593be9285498d42f6aac0eda9d8a4dc32f8a4e7669b245c03ee7553af","evidenceBoundary":{"c1":0,"e1":0,"formalEvidence":false,"g1":0,"o1":0,"productSupport":false,"r1Pipeline":0,"r1ProductRelease":0,"r1ProductValidation":0,"releaseAllowlist":"none","releaseApproved":0,"releaseRegistered":0,"u1":0,"v1":0},"expectedCanonicalJson":"{\"alphaMode\":\"straight-unpremultiplied\",\"alphaPresent\":true,\"animation\":\"forbidden\",\"colorSpace\":\"embedded-sRGB\",\"decodedPixelSha256\":\"a19166dbd95f3ae5285d757f818920ea1e3ef65c35299a7d0ab61f79749c66e4\",\"fileSha256\":null,\"height\":8,\"interlace\":\"forbidden\",\"metadataPolicy\":\"strip-all-except-color-contract\",\"mime\":\"image/png\",\"orientation\":1,\"parentIdentity\":{\"artifactSha256\":\"ea059f2d7fc750a3fd29c3369ce0ba9939976fd01d8c2addc61ed73e431d4b0d\",\"decodedPixelSha256\":\"a19166dbd95f3ae5285d757f818920ea1e3ef65c35299a7d0ab61f79749c66e4\",\"fileSha256\":\"306e77233eabaf01641bd566d22cf1570d464783237011958ea30342cdcb608a\",\"id\":\"normalized.s05.export.dev.018\",\"manifestSha256\":\"64770b374786f37421673116e75109218725c4b8e920a1e55c110a34fd16d16c\"},\"pixelLayout\":\"RGBA8\",\"pngFilterPolicy\":\"filter-0-only\",\"width\":19}","frozenAt":"2026-08-15T23:01:50.529Z","id":"gold-identity.s11.export.dev.018","independenceClaim":false,"manifestLocator":{"id":"FM-OPEN-CALIBRATION-EXPORT-DEV@0.11.0","path":"manifests/export-dev.v0.11.0.json"},"operation":"export","partition":"dev/calibration","priorSlice10GoldIdentityRef":{"byteLength":2539,"contentHash":"6970a95cc70ed7a0f6659e6e4c5d1dd8566e92c517d12d0b8369d9a44b69ee75","fileSha256":"69b5b4ff55c49ae3e05c54eda0cea10a69e3c8a732d609718326366794b2b8fd","id":"gold-identity.s10.export.dev.018","path":"research/slice-10/gold-identities/export/dev-calibration/gold-identity.s10.export.dev.018.json"},"schemaVersion":"gold-identity.slice11.v0","sourceRef":{"byteLength":1790,"contentHash":"9a6eba7250bc3a20e232ab3dbc0446f20b84c74cf43f1991d5eb2401c7021c5e","fileSha256":"d65590070c2bef2ae9551734ef44a5d460b6ac64aae22b16c2d7658772348f57","id":"s11.export.dev.018","path":"source-lineage/export/dev-calibration/s11.export.dev.018.json"}}
