{"candidateDependencyUsed":false,"candidateOutputUsed":false,"contentHash":"0817b430c4f624b7d6ff17086c9f449c09e3ca7e206237857da7cdc78a8b72de","evidenceBoundary":{"c1":0,"e1":0,"formalEvidence":false,"g1":0,"o1":0,"productSupport":false,"r1Pipeline":0,"r1ProductRelease":0,"r1ProductValidation":0,"releaseAllowlist":"none","releaseApproved":0,"releaseRegistered":0,"u1":0,"v1":0},"expectedCanonicalJson":"{\"alphaMode\":\"straight-unpremultiplied\",\"alphaPresent\":false,\"animation\":\"forbidden\",\"colorSpace\":\"embedded-sRGB\",\"decodedPixelSha256\":\"90ed4bc2eab2f1c1fdc4cdea9ad1862cc7838f5d20ae68c58778666af5a185ad\",\"fileSha256\":null,\"height\":17,\"interlace\":\"forbidden\",\"metadataPolicy\":\"strip-all-except-color-contract\",\"mime\":\"image/png\",\"orientation\":1,\"parentIdentity\":{\"artifactSha256\":\"0873b654fe4d638764bbae6b29e2820be0693b356aa433d63737cf3123d3f672\",\"decodedPixelSha256\":\"90ed4bc2eab2f1c1fdc4cdea9ad1862cc7838f5d20ae68c58778666af5a185ad\",\"fileSha256\":\"d17265a76c286dddf79b81f9d2e168507400a27e6a8483fe713014faa22933fa\",\"id\":\"normalized.s05.export.dev.004\",\"manifestSha256\":\"5c988c69c38145357cdf89aaa468152cafe9dc372a4cf2599ee21e3fad5577e6\"},\"pixelLayout\":\"RGBA8\",\"pngFilterPolicy\":\"filter-0-only\",\"width\":18}","frozenAt":"2026-08-15T23:01:50.529Z","id":"gold-identity.s11.export.dev.004","independenceClaim":false,"manifestLocator":{"id":"FM-OPEN-CALIBRATION-EXPORT-DEV@0.11.0","path":"manifests/export-dev.v0.11.0.json"},"operation":"export","partition":"dev/calibration","priorSlice10GoldIdentityRef":{"byteLength":2541,"contentHash":"45309ed6787c0ed0113db9c49581beac4f1d5dd3e82a825145bb0e58e4c03e91","fileSha256":"e97eec3e55a1fc62b0696358128da60da3f6e9f6068c90e63c7b67eff99e1124","id":"gold-identity.s10.export.dev.004","path":"research/slice-10/gold-identities/export/dev-calibration/gold-identity.s10.export.dev.004.json"},"schemaVersion":"gold-identity.slice11.v0","sourceRef":{"byteLength":1786,"contentHash":"5c16ebe673a76daeb596c03826a7cc97e9ba594dd6b76649d198b71a3b102c4a","fileSha256":"21514361fa141b200c43e4547d40f3feb092ba2d4ff120dd2bb78929260f4394","id":"s11.export.dev.004","path":"source-lineage/export/dev-calibration/s11.export.dev.004.json"}}
