{"candidateDependencyUsed":false,"candidateOutputUsed":false,"contentHash":"0c7270930400db0b81f0e292204215afdad083a4f5902a6db6b95a65f6d3b1d2","evidenceBoundary":{"c1":0,"e1":0,"formalEvidence":false,"g1":0,"o1":0,"productSupport":false,"r1Pipeline":0,"r1ProductRelease":0,"r1ProductValidation":0,"releaseAllowlist":"none","releaseApproved":0,"releaseRegistered":0,"u1":0,"v1":0},"expectedCanonicalJson":"{\"alphaMode\":\"straight-unpremultiplied\",\"alphaPresent\":false,\"animation\":\"forbidden\",\"colorSpace\":\"embedded-sRGB\",\"decodedPixelSha256\":\"fa34720b8c58c5828564161ad483444d158179522ae0775e9aa9c1d5eef7569b\",\"fileSha256\":null,\"height\":18,\"interlace\":\"forbidden\",\"metadataPolicy\":\"strip-all-except-color-contract\",\"mime\":\"image/png\",\"orientation\":1,\"parentIdentity\":{\"artifactSha256\":\"55db00a6c3df298d9a596b3aaca0c395b36663ebebd35cebe85488b8577caefb\",\"decodedPixelSha256\":\"fa34720b8c58c5828564161ad483444d158179522ae0775e9aa9c1d5eef7569b\",\"fileSha256\":\"c97b878df7873e0ab43ff30528eb13930cf3c285c569d7b965825e314815a154\",\"id\":\"normalized.s05.export.dev.005\",\"manifestSha256\":\"bdb9bcc33322e86527d25884e56af855e35e516b3654b81da220559bfa133ddd\"},\"pixelLayout\":\"RGBA8\",\"pngFilterPolicy\":\"filter-0-only\",\"width\":18}","frozenAt":"2026-08-15T23:01:50.529Z","id":"gold-identity.s11.export.dev.005","independenceClaim":false,"manifestLocator":{"id":"FM-OPEN-CALIBRATION-EXPORT-DEV@0.11.0","path":"manifests/export-dev.v0.11.0.json"},"operation":"export","partition":"dev/calibration","priorSlice10GoldIdentityRef":{"byteLength":2541,"contentHash":"1b38655381304a348b7773828558472406f2b4a65d50eebe12d275ce3c9527e1","fileSha256":"632a758f1ccc41dd3dd776f57440ff5a1968ab64726e34e1f676f883c29cdf27","id":"gold-identity.s10.export.dev.005","path":"research/slice-10/gold-identities/export/dev-calibration/gold-identity.s10.export.dev.005.json"},"schemaVersion":"gold-identity.slice11.v0","sourceRef":{"byteLength":1786,"contentHash":"13db4a9c8018f3e816ecf9551b7cb092dd9251b9dbf6250a97bf280672dd4e7b","fileSha256":"69a42b0ebb10a7b3d12751d64f1f76a80e4d1d88577fa5a1af459c6bbb3afca6","id":"s11.export.dev.005","path":"source-lineage/export/dev-calibration/s11.export.dev.005.json"}}
