{"candidateDependencyUsed":false,"candidateOutputUsed":false,"contentHash":"e48e8ec12eb98a8dc0fa15483312a8ea40e67e2fde44cbf5d076db30c37a7ec1","evidenceBoundary":{"c1":0,"e1":0,"formalEvidence":false,"g1":0,"o1":0,"productSupport":false,"r1Pipeline":0,"r1ProductRelease":0,"r1ProductValidation":0,"releaseAllowlist":"none","releaseApproved":0,"releaseRegistered":0,"u1":0,"v1":0},"expectedCanonicalJson":"{\"alphaMode\":\"straight-unpremultiplied\",\"alphaPresent\":true,\"animation\":\"forbidden\",\"colorSpace\":\"embedded-sRGB\",\"decodedPixelSha256\":\"eb75075a9d02a60f2b50fe816770b8dd29aed78c8447278484862d14be4e6158\",\"fileSha256\":null,\"height\":20,\"interlace\":\"forbidden\",\"metadataPolicy\":\"strip-all-except-color-contract\",\"mime\":\"image/png\",\"orientation\":1,\"parentIdentity\":{\"artifactSha256\":null,\"decodedPixelSha256\":\"eb75075a9d02a60f2b50fe816770b8dd29aed78c8447278484862d14be4e6158\",\"fileSha256\":\"df7d242493d88adb5e6472685c3b1c68746313eaba3a112a4cff7ee77ed17e13\",\"id\":\"raw.s05.normalize.dev.018\",\"manifestSha256\":\"1a987af3a290f26a9339a833c93a0d65478630049cf026bf8aeac4f9b5598ef5\"},\"pixelLayout\":\"RGBA8\",\"pngFilterPolicy\":\"filter-0-only\",\"width\":22}","frozenAt":"2026-08-15T23:01:50.529Z","id":"gold-identity.s11.normalize.dev.018","independenceClaim":false,"manifestLocator":{"id":"FM-OPEN-CALIBRATION-NORMALIZE-DEV@0.11.0","path":"manifests/normalize-dev.v0.11.0.json"},"operation":"normalize","partition":"dev/calibration","priorSlice10GoldIdentityRef":{"byteLength":2174,"contentHash":"dab5d73dadb6df15ebd4788e8d27aeb9dcd35001e427fb51c3f10711c804dec5","fileSha256":"ddebd7ca8ab4a34e67c546c635c1ddd2470f3de915484ce6bd406709dfab8438","id":"gold-identity.s10.normalize.dev.018","path":"research/slice-10/gold-identities/normalize/dev-calibration/gold-identity.s10.normalize.dev.018.json"},"schemaVersion":"gold-identity.slice11.v0","sourceRef":{"byteLength":1822,"contentHash":"976cd5a2cebee80886494377d8a316b0bb81aa420fb9fd579c133aeca90d4bf2","fileSha256":"cdc33ad4d1906597a3687479f352c1069b41999fb2b18109728824ed3da96ede","id":"s11.normalize.dev.018","path":"source-lineage/normalize/dev-calibration/s11.normalize.dev.018.json"}}
