{"candidateDependencyUsed":false,"candidateOutputUsed":false,"contentHash":"ff8b2c3cc4ef3330daeabd5ac8a73476cbc13ec42aaac4feaa252abdb86e15ae","evidenceBoundary":{"c1":0,"e1":0,"formalEvidence":false,"g1":0,"o1":0,"productSupport":false,"r1Pipeline":0,"r1ProductRelease":0,"r1ProductValidation":0,"releaseAllowlist":"none","releaseApproved":0,"releaseRegistered":0,"u1":0,"v1":0},"expectedCanonicalJson":"{\"alphaMode\":\"straight-unpremultiplied\",\"alphaPresent\":false,\"animation\":\"forbidden\",\"colorSpace\":\"embedded-sRGB\",\"decodedPixelSha256\":\"f508ec8e42175f52ea3e80aa10a8aea07b102605de0fce31bca3427c7b3f141b\",\"fileSha256\":null,\"height\":16,\"interlace\":\"forbidden\",\"metadataPolicy\":\"strip-all-except-color-contract\",\"mime\":\"image/png\",\"orientation\":1,\"parentIdentity\":{\"artifactSha256\":null,\"decodedPixelSha256\":\"f508ec8e42175f52ea3e80aa10a8aea07b102605de0fce31bca3427c7b3f141b\",\"fileSha256\":\"9bb555e237f040531607d7b1ae31dff161ed844829a58ad0e058bb2124403555\",\"id\":\"raw.s05.normalize.defect.001\",\"manifestSha256\":\"0765393bcf6f40dc3ff46cffffd84524e1fc9237d430d6953dd8eec0324a02c0\"},\"pixelLayout\":\"RGBA8\",\"pngFilterPolicy\":\"filter-0-only\",\"width\":15}","frozenAt":"2026-08-15T23:01:50.529Z","id":"gold-identity.s11.normalize.defect.001","independenceClaim":false,"manifestLocator":{"id":"FM-OPEN-CALIBRATION-NORMALIZE-DEFECT@0.11.0","path":"manifests/normalize-defect.v0.11.0.json"},"operation":"normalize","partition":"defect/calibration","priorSlice10GoldIdentityRef":{"byteLength":2208,"contentHash":"47905f91be13fdb6eb6c690ee5d85d65d65afd27430a9e3e28f3334fdd140df8","fileSha256":"65d384e8e0c68026f97cc906801b9ffaf9d8f90130599c7928039c06c4d81aaa","id":"gold-identity.s10.normalize.defect.001","path":"research/slice-10/gold-identities/normalize/defect-calibration/gold-identity.s10.normalize.defect.001.json"},"schemaVersion":"gold-identity.slice11.v0","sourceRef":{"byteLength":1866,"contentHash":"58164a5844490ec01759c6b28355e9a807c9ac5c8f26b6e2b372b4cd7d2d4045","fileSha256":"2bf295c43b178f5215bbc7f1ceb065891bfba546fce9dedad539b5e876342c9d","id":"s11.normalize.defect.001","path":"source-lineage/normalize/defect-calibration/s11.normalize.defect.001.json"}}
