{"candidateDependencyUsed":false,"candidateOutputUsed":false,"contentHash":"92dd05af9b2ad250e31c4258360ede659c77e692f181f7d0e45816cfecb6680e","evidenceBoundary":{"c1":0,"e1":0,"formalEvidence":false,"g1":0,"o1":0,"productSupport":false,"r1Pipeline":0,"r1ProductRelease":0,"r1ProductValidation":0,"releaseAllowlist":"none","releaseApproved":0,"releaseRegistered":0,"u1":0,"v1":0},"expectedCanonicalJson":"{\"alphaMode\":\"straight-unpremultiplied\",\"alphaPresent\":true,\"animation\":\"forbidden\",\"colorSpace\":\"embedded-sRGB\",\"decodedPixelSha256\":\"40338f379c4e2825991dbc4c20b39f8b54c4cdd4799e0780b8c0b34f46430eef\",\"fileSha256\":null,\"height\":9,\"interlace\":\"forbidden\",\"metadataPolicy\":\"strip-all-except-color-contract\",\"mime\":\"image/png\",\"orientation\":1,\"parentIdentity\":{\"artifactSha256\":null,\"decodedPixelSha256\":\"40338f379c4e2825991dbc4c20b39f8b54c4cdd4799e0780b8c0b34f46430eef\",\"fileSha256\":\"ee093762c7f7ed9096f6637e69746811c37cd56276218e3eb4add5ea0ad26ad9\",\"id\":\"raw.s05.normalize.dev.014\",\"manifestSha256\":\"08f927661f13dcaa51139c0488e261a7e9e52763c40b2922372ca98e3eabf2c2\"},\"pixelLayout\":\"RGBA8\",\"pngFilterPolicy\":\"filter-0-only\",\"width\":23}","frozenAt":"2026-08-15T23:01:50.529Z","id":"gold-identity.s11.normalize.dev.014","independenceClaim":false,"manifestLocator":{"id":"FM-OPEN-CALIBRATION-NORMALIZE-DEV@0.11.0","path":"manifests/normalize-dev.v0.11.0.json"},"operation":"normalize","partition":"dev/calibration","priorSlice10GoldIdentityRef":{"byteLength":2173,"contentHash":"a395cd83fd380b0834cc95aa0dc9ced846a85e0ef3292aa29eff918525b72749","fileSha256":"f7fd24f00d75126a60797ca6f0d6ec5dba05f54fbc405a1275e4ed593fb82d1f","id":"gold-identity.s10.normalize.dev.014","path":"research/slice-10/gold-identities/normalize/dev-calibration/gold-identity.s10.normalize.dev.014.json"},"schemaVersion":"gold-identity.slice11.v0","sourceRef":{"byteLength":1821,"contentHash":"c29c34eec3f021a2bc47d7e3a4dab60a70b4f34dd8c5a3b78658fffea44c59b1","fileSha256":"a975fbe4b1cdcdc5a5b636f5d376856fd779e44d86b9b40127341598c71af1fb","id":"s11.normalize.dev.014","path":"source-lineage/normalize/dev-calibration/s11.normalize.dev.014.json"}}
