{"candidateDependencyUsed":false,"candidateOutputUsed":false,"contentHash":"5fa6a655edf2621222fba8e1261d1ab7fb7786db19caa104eac7083df643d17c","evidenceBoundary":{"c1":0,"e1":0,"formalEvidence":false,"g1":0,"o1":0,"productSupport":false,"r1Pipeline":0,"r1ProductRelease":0,"r1ProductValidation":0,"releaseAllowlist":"none","releaseApproved":0,"releaseRegistered":0,"u1":0,"v1":0},"expectedCanonicalJson":"{\"alphaMode\":\"straight-unpremultiplied\",\"alphaPresent\":true,\"animation\":\"forbidden\",\"colorSpace\":\"embedded-sRGB\",\"decodedPixelSha256\":\"431efc4d450bbcf0cf762e5c5d52fedecab160082713fce244184b1c8d3c9c72\",\"fileSha256\":null,\"height\":21,\"interlace\":\"forbidden\",\"metadataPolicy\":\"strip-all-except-color-contract\",\"mime\":\"image/png\",\"orientation\":1,\"parentIdentity\":{\"artifactSha256\":null,\"decodedPixelSha256\":\"431efc4d450bbcf0cf762e5c5d52fedecab160082713fce244184b1c8d3c9c72\",\"fileSha256\":\"b27d82473e55d9731da0306fa7f8610cd5f72584d8247f2102943931615bc2fb\",\"id\":\"raw.s05.normalize.defect.004\",\"manifestSha256\":\"14805773a4208a911e22588d3d3ab3bb1ae67d8599778db8c37d8b4fe1cfa98d\"},\"pixelLayout\":\"RGBA8\",\"pngFilterPolicy\":\"filter-0-only\",\"width\":24}","frozenAt":"2026-08-15T23:01:50.529Z","id":"gold-identity.s11.normalize.defect.004","independenceClaim":false,"manifestLocator":{"id":"FM-OPEN-CALIBRATION-NORMALIZE-DEFECT@0.11.0","path":"manifests/normalize-defect.v0.11.0.json"},"operation":"normalize","partition":"defect/calibration","priorSlice10GoldIdentityRef":{"byteLength":2207,"contentHash":"cca671f506e868cad755f06cd8df3ffe1c13fac2fa8d8a71e4a65109286f28a2","fileSha256":"d27968e3c3669ad1d135f8bd3cd5858d138199b899d3b3cd87e544614000b886","id":"gold-identity.s10.normalize.defect.004","path":"research/slice-10/gold-identities/normalize/defect-calibration/gold-identity.s10.normalize.defect.004.json"},"schemaVersion":"gold-identity.slice11.v0","sourceRef":{"byteLength":1874,"contentHash":"fd4496db4bf380822364d3a67b333ab6cd535e242a5750ab2e306f264629927d","fileSha256":"497e488d2567c2588cfe24019b653c15e9c11fa40ecbec75c17a01e0b7f54712","id":"s11.normalize.defect.004","path":"source-lineage/normalize/defect-calibration/s11.normalize.defect.004.json"}}
